12/8/22 11:52,12/8/22 11:56,0,173.79.84.236,100,230,1,12/8/22 11:56,R_4NO6wo5GDivbvAR,,,,,38.7592,-76.9858,anonymous,EN,1,3,3,7,7,10,6,8,11,10,10,8,6,2,10,6,9,7,6,7,5,2,7,9,6,2,2,7|2|18|26|25|8|4|12|9|20|16|19|1|6|22|13|10|23|17|15|11|5|14|3|24|21,,,,,,,,,,,,,,,,,,,,,,,,,,,,,,,,,,,,,,,,,,,,,,,,,,,,,,,,,,,,,,,,,,,,,,,,,,,,,,,,,"People who use corporate double-speak are often lying for their own ends.  They don't have a lot of ethics, but are smart and ambitious.  Things about gullibility and spirituality I rated low.  Things like good personality and attractiveness I put in the middle, as it could go either way.",37,2,,6,,,corporate_bullshitter
12/8/22 11:54,12/8/22 11:56,0,68.82.50.181,100,145,1,12/8/22 11:56,R_2YRG6OexP8Od5gm,,,,,40.0022,-75.3008,anonymous,EN,1,,,,,,,,,,,,,,,,,,,,,,,,,,,,,,,,,,,,,,,,,,,,,,,,,,,,,,,,,,,,,,,,,,,,,,,,,,,,,,,,,5,5,4,3,4,3,4,6,6,5,4,5,3,5,5,5,4,5,6,6,5,5,5,5,4,4,12|7|22|8|9|15|21|18|14|26|19|13|23|3|20|5|11|17|10|25|1|24|6|2|16|4,The examples given were pushing for innovation and I think a lot of changes requires starting from somewhere. I do not agree that these are bullshit and I think these were mainly from ambitious people who wanted change.,31,2,,1,,,social_bullshittee
12/8/22 11:54,12/8/22 11:56,0,24.168.198.182,100,161,1,12/8/22 11:56,R_2XnvPxbdoHXFL5R,,,,,34.0737,-81.1863,anonymous,EN,1,,,,,,,,,,,,,,,,,,,,,,,,,,,,,,,,,,,,,,,,,,,,,,,,,,,,,,,4,3,8,10,8,7,9,11,10,9,3,1,6,4,3,4,2,2,6,4,7,8,9,7,10,4,,,,,,,,,,,,,,,,,,,,,,,,,,,,I believe that bullshitters are people who enjoy lying and generally aren't good people.,33,1,,6,,,corporate_bullshittee
12/8/22 11:53,12/8/22 11:56,0,73.41.249.106,100,217,1,12/8/22 11:56,R_2wyr7HjP2UxUskf,,,,,37.6755,-121.0068,anonymous,EN,1,,,,,,,,,,,,,,,,,,,,,,,,,,,,,,,,,,,,,,,,,,,,,,,,,,,,,,,,,,,,,,,,,,,,,,,,,,,,,,,,,6,6,6,6,6,6,6,6,6,6,6,6,6,6,6,6,6,6,6,6,6,6,6,6,6,6,4|15|10|5|23|2|21|12|6|17|1|3|8|25|14|13|7|18|11|26|16|24|9|22|19|20,its subjective. bullshit could come from anywhere. the person bullshitting could be acting in different ways so its hard to just tailor it to specific things when it is vast. ,36,1,,6,,,social_bullshittee
12/8/22 11:50,12/8/22 11:57,0,24.158.128.3,100,375,1,12/8/22 11:57,R_VUnW29MgYkjvK8x,,,,,36.5686,-82.1819,anonymous,EN,1,,,,,,,,,,,,,,,,,,,,,,,,,,,,,,,,,,,,,,,,,,,,,,,,,,,,,,,,,,,,,,,,,,,,,,,,,,,,,,,,,4,4,7,5,10,5,8,5,5,7,4,5,9,4,4,6,5,5,5,5,5,6,5,4,7,7,14|17|16|26|7|23|18|24|8|22|3|12|10|1|6|4|19|13|5|15|21|25|11|20|2|9,I thought about how much each characteristic related to the trait. I tried to imagine an average person who exhibited this trait.,30,1,,6,,,social_bullshittee
12/8/22 11:53,12/8/22 11:57,0,98.22.6.12,100,262,1,12/8/22 11:57,R_1mw39z8X7NwYvib,,,,,41.6892,-93.0534,anonymous,EN,1,,,,,,,,,,,,,,,,,,,,,,,,,,,,2,2,6,9,5,5,10,9,7,3,3,5,7,3,3,7,6,3,2,5,2,4,4,2,8,3,18|13|19|24|25|2|10|15|11|17|5|20|16|12|7|6|9|21|23|22|4|1|8|3|26|14,,,,,,,,,,,,,,,,,,,,,,,,,,,,,,,,,,,,,,,,,,,,,,,,,,,,,,I imagined the personality type that would engage in such bullshit without regards for the truth. I also thought of people that I have known that are bullshitters. ,52,1,,6,,,social_bullshitter
12/8/22 11:54,12/8/22 11:57,0,172.58.4.111,100,166,1,12/8/22 11:57,R_3PGdGkSMFCCIg5J,,,,,33.8895,-84.2921,anonymous,EN,1,1,2,7,10,9,9,9,3,2,6,9,1,8,8,1,1,1,1,1,1,1,2,4,1,4,1,22|2|9|14|11|8|16|10|4|19|23|13|18|24|25|20|15|17|6|5|26|12|7|21|3|1,,,,,,,,,,,,,,,,,,,,,,,,,,,,,,,,,,,,,,,,,,,,,,,,,,,,,,,,,,,,,,,,,,,,,,,,,,,,,,,,,I feel corporate speak is inherently dishonest and the things they say tend to be facetious. ,23,1,,6,,,corporate_bullshitter
12/8/22 11:56,12/8/22 11:58,0,50.219.168.178,100,79,1,12/8/22 11:58,R_b0WX1UG2PXHKU8h,,,,,40.2329,-111.6688,anonymous,EN,1,,,,,,,,,,,,,,,,,,,,,,,,,,,,10,10,10,10,10,10,11,9,11,11,10,10,9,10,10,10,10,10,11,9,10,9,10,10,11,10,19|17|10|5|3|15|2|6|22|13|1|21|8|26|20|23|9|12|11|18|24|25|7|4|16|14,,,,,,,,,,,,,,,,,,,,,,,,,,,,,,,,,,,,,,,,,,,,,,,,,,,,,,Based on personal opinion. I tried to react based on personal reaction,27,1,,6,,,social_bullshitter
12/8/22 11:54,12/8/22 11:58,0,24.95.181.46,100,240,1,12/8/22 11:58,R_1l9pFYvgIcCTAgf,,,,,38.4736,-82.6413,anonymous,EN,1,,,,,,,,,,,,,,,,,,,,,,,,,,,,2,1,8,7,7,8,10,10,7,7,2,4,8,6,1,9,7,6,4,3,2,4,3,4,6,3,2|15|17|13|22|9|11|6|7|23|26|21|19|10|8|25|3|16|18|1|20|5|24|12|4|14,,,,,,,,,,,,,,,,,,,,,,,,,,,,,,,,,,,,,,,,,,,,,,,,,,,,,,I tried to remember the example sentences as well as think of examples from everyday life or personal observation.,50,2,,6,,,social_bullshitter
12/8/22 11:51,12/8/22 11:58,0,24.91.31.117,100,408,1,12/8/22 11:58,R_2YPXBUUUoNmxYoH,,,,,42.3654,-72.4671,anonymous,EN,1,,,,,,,,,,,,,,,,,,,,,,,,,,,,2,2,8,10,7,7,10,10,10,9,6,6,3,6,2,10,9,3,6,4,2,4,3,2,3,3,16|22|13|18|20|3|17|2|19|5|10|12|7|21|9|11|25|14|1|6|15|4|26|24|23|8,,,,,,,,,,,,,,,,,,,,,,,,,,,,,,,,,,,,,,,,,,,,,,,,,,,,,,I arrived at my answers by visualizing a bullshitter spewing bullshit.  I then evaluated how this imaginary bullshitter fulfilled the characteristics you asked on the previous page. ,63,1,,6,,,social_bullshitter
12/8/22 11:52,12/8/22 11:58,0,71.208.159.64,100,388,1,12/8/22 11:58,R_tGs0fpr6GCby4JH,,,,,26.5544,-81.9021,anonymous,EN,1,,,,,,,,,,,,,,,,,,,,,,,,,,,,,,,,,,,,,,,,,,,,,,,,,,,,,,,,,,,,,,,,,,,,,,,,,,,,,,,,,5,7,5,6,4,4,6,6,6,6,5,7,8,6,4,10,8,6,7,7,4,6,6,6,8,6,16|23|13|14|6|10|2|24|22|17|19|20|11|18|26|5|12|8|25|15|4|9|7|3|1|21,"People who take these statements at face value aren't necessarily stupid; rather, they tend to value people and interactions highly enough that they suspend their disbelief in order to participate in the discussion. They may do this unconsciously, and realize that the reasoning is specious if pressed to think about it more deeply.",39,2,,6,,,social_bullshittee
12/8/22 11:54,12/8/22 11:58,0,172.56.23.145,100,226,1,12/8/22 11:58,R_1IKpfmsEofZSWki,,,,,41.1631,-73.214,anonymous,EN,1,,,,,,,,,,,,,,,,,,,,,,,,,,,,,,,,,,,,,,,,,,,,,,,,,,,,,,,,,,,,,,,,,,,,,,,,,,,,,,,,,7,6,6,7,5,6,5,7,6,6,7,6,5,9,7,7,8,5,6,7,8,8,6,8,7,6,2|7|3|25|9|16|17|6|20|22|12|8|24|26|5|15|23|4|1|18|10|14|21|11|13|19,I’m think all people are deifferent: it’s hard to try and rope people in to certain categories without fully knowing them ,34,1,,6,,,social_bullshittee
12/8/22 11:54,12/8/22 11:58,0,47.199.190.232,100,277,1,12/8/22 11:58,R_wT8iO0eNc8NtfaN,,,,,28.0684,-82.7593,anonymous,EN,1,,,,,,,,,,,,,,,,,,,,,,,,,,,,,,,,,,,,,,,,,,,,,,,,,,,,,,,5,5,2,9,6,4,5,10,10,5,4,5,10,3,3,8,6,6,6,3,2,7,7,5,10,2,,,,,,,,,,,,,,,,,,,,,,,,,,,,"I thought about people I have known or whom I know who believe ""bullshit,"" and I thought about what they had in common. Really smart intelligent people or people with a lot of common sense, both type of whom are not gullible, are generally more likely to call bullshit and to ask for clarification on nonsensical but profoun-sounding statements.",57,2,,6,,,corporate_bullshittee
12/8/22 11:55,12/8/22 11:59,0,96.63.189.62,100,233,1,12/8/22 11:59,R_1HbozeKDQJ0Tk6u,,,,,42.4718,-96.3549,anonymous,EN,1,,,,,,,,,,,,,,,,,,,,,,,,,,,,,,,,,,,,,,,,,,,,,,,,,,,,,,,2,2,8,10,8,9,11,8,8,9,6,4,4,8,3,10,6,8,7,7,7,9,9,8,4,2,,,,,,,,,,,,,,,,,,,,,,,,,,,,Someone who does that is more of a sales person.  Usually social and attractive.  Would say anything to get it sold.  No real moral values.,33,2,,6,,,corporate_bullshittee
12/8/22 11:55,12/8/22 11:59,0,72.180.17.17,100,230,1,12/8/22 11:59,R_3PAnQEP872ryq1Y,,,,,33.0176,-96.9926,anonymous,EN,1,,,,,,,,,,,,,,,,,,,,,,,,,,,,,,,,,,,,,,,,,,,,,,,,,,,,,,,,,,,,,,,,,,,,,,,,,,,,,,,,,2,3,7,10,10,6,10,6,6,10,4,3,7,3,2,3,2,4,2,5,2,7,2,1,2,1,15|5|4|26|12|10|17|20|13|25|16|2|8|18|23|6|3|7|19|24|14|1|21|11|9|22,"People with these personalities, where they intentionally mislead people and just want to sound good, don't have very good traits. I have experienced them myself and they  typically just care about themselves and how they look. I have seen this myself personally and experienced it. I arrived to the conclusion about these various traits that the person is self-centered and not very intelligent because they are not socially conscious and don't care about others.",38,1,,6,,,social_bullshittee
12/8/22 11:54,12/8/22 11:59,0,98.27.228.205,100,283,1,12/8/22 11:59,R_2a92qisQUbC7Sz0,,,,,41.4459,-81.4212,anonymous,EN,1,,,,,,,,,,,,,,,,,,,,,,,,,,,,3,2,5,11,9,7,8,6,9,11,6,6,1,8,3,9,6,6,5,6,4,9,9,6,1,3,19|1|11|6|7|3|15|22|13|17|9|14|10|2|21|23|20|16|18|25|26|4|5|12|24|8,,,,,,,,,,,,,,,,,,,,,,,,,,,,,,,,,,,,,,,,,,,,,,,,,,,,,,"I thought of people I personally know who are bullshitters and thought about their attributes.  Not all bullshitters are the same; some are truly full of it and others believe their own stories.  Therefore some attributes will be the same, some different.",61,2,,6,,,social_bullshitter
12/8/22 11:49,12/8/22 11:59,0,35.138.238.49,100,623,1,12/8/22 11:59,R_2CHxVDPxytYWelW,,,,,28.2475,-82.4943,anonymous,EN,1,,,,,,,,,,,,,,,,,,,,,,,,,,,,,,,,,,,,,,,,,,,,,,,,,,,,,,,8,5,4,7,6,4,4,7,7,5,4,8,10,5,4,8,9,7,7,7,5,4,4,6,10,3,,,,,,,,,,,,,,,,,,,,,,,,,,,,"Just based on my gut instincts. I think with people like that the biggest trait is, ""laziness."" People that don't want to critically think or research and just go with what they hear.",37,1,,6,,,corporate_bullshittee
12/8/22 11:56,12/8/22 11:59,0,47.232.36.93,100,223,1,12/8/22 11:59,R_AhW66dTIIsqsyIh,,,,,44.7499,-93.2081,anonymous,EN,1,,,,,,,,,,,,,,,,,,,,,,,,,,,,7,9,7,7,8,7,7,6,7,7,7,8,8,8,7,6,7,8,8,8,6,8,8,8,9,8,21|9|1|5|11|25|18|17|13|15|2|16|12|10|4|6|7|22|19|14|8|24|3|26|20|23,,,,,,,,,,,,,,,,,,,,,,,,,,,,,,,,,,,,,,,,,,,,,,,,,,,,,,I figured the term is pretty common and its interpreted differently sometimes. ,28,1,,6,,,social_bullshitter
12/8/22 11:55,12/8/22 11:59,0,108.91.68.165,100,231,1,12/8/22 11:59,R_DMKKygKiBmv47FD,,,,,37.9964,-122.2901,anonymous,EN,1,1,1,9,11,10,11,11,11,9,3,4,1,5,7,1,2,2,1,4,5,1,4,1,1,3,1,10|13|26|12|14|20|9|5|6|4|8|23|17|1|25|22|3|2|19|18|16|21|24|11|7|15,,,,,,,,,,,,,,,,,,,,,,,,,,,,,,,,,,,,,,,,,,,,,,,,,,,,,,,,,,,,,,,,,,,,,,,,,,,,,,,,,"I've heard statements like these before, and they always seem to be deep, but they're meant to confuse.",62,2,,6,,,corporate_bullshitter
12/8/22 11:57,12/8/22 11:59,0,75.117.14.5,100,130,1,12/8/22 11:59,R_1EYbiqdA4qWV31E,,,,,31.2462,-83.6549,anonymous,EN,1,1,2,8,11,11,8,10,10,11,10,6,2,7,5,2,4,5,7,2,2,1,7,3,4,5,2,15|7|3|19|11|24|23|8|22|10|4|13|16|12|14|26|17|1|25|18|6|9|21|2|20|5,,,,,,,,,,,,,,,,,,,,,,,,,,,,,,,,,,,,,,,,,,,,,,,,,,,,,,,,,,,,,,,,,,,,,,,,,,,,,,,,,Those statements are things an idiot who is trying to appear intelligent would say. ,44,2,,6,,,corporate_bullshitter
12/8/22 11:55,12/8/22 11:59,0,52.94.133.130,100,229,1,12/8/22 11:59,R_UGwjnHUC98KETQJ,,,,,39.0469,-77.4903,anonymous,EN,1,,,,,,,,,,,,,,,,,,,,,,,,,,,,,,,,,,,,,,,,,,,,,,,,,,,,,,,,,,,,,,,,,,,,,,,,,,,,,,,,,6,6,1,2,1,1,5,6,5,2,3,8,11,2,2,9,9,6,6,6,2,3,2,2,11,11,1|2|14|4|10|13|25|11|17|18|5|9|21|23|8|16|6|7|19|26|3|12|20|22|15|24,"I feel like they are probably not highly intelligent and very gullible. Other than that, it's hard to assign some traits without knowing more.",34,2,,6,,,social_bullshittee
12/8/22 11:59,12/8/22 11:59,0,73.163.255.161,100,38,1,12/8/22 11:59,R_vqswFVYzITQvZjb,,,,,38.8155,-77.1205,anonymous,EN,1,6,6,6,6,6,6,6,6,6,6,6,6,6,6,6,6,6,6,6,6,6,6,6,6,6,6,20|17|4|26|3|6|10|25|1|7|22|11|23|24|5|16|15|9|14|2|12|8|21|13|19|18,,,,,,,,,,,,,,,,,,,,,,,,,,,,,,,,,,,,,,,,,,,,,,,,,,,,,,,,,,,,,,,,,,,,,,,,,,,,,,,,,indifferent ,24,2,,1,,,corporate_bullshitter
12/8/22 11:49,12/8/22 11:59,0,71.204.165.180,100,646,1,12/8/22 11:59,R_2xx8sop0sGLRVaB,,,,,37.3859,-122.0882,anonymous,EN,1,2,2,6,11,11,1,10,11,9,10,6,4,9,8,3,6,6,2,4,3,6,7,4,4,11,1,17|15|26|11|22|18|23|12|25|13|2|7|4|6|24|8|14|20|21|16|9|1|10|3|19|5,,,,,,,,,,,,,,,,,,,,,,,,,,,,,,,,,,,,,,,,,,,,,,,,,,,,,,,,,,,,,,,,,,,,,,,,,,,,,,,,,Such a person is ambitious who craftily uses the words to talk bullshit and thinks that it would impress and deceive most people. His words are hollow.  He is using his mastery over English language to create bullshit and to mislead peopele.,37,2,,1,,,corporate_bullshitter
12/8/22 11:56,12/8/22 11:59,0,76.150.156.6,100,228,1,12/8/22 11:59,R_2qpBRSaQxjeseXA,,,,,41.7688,-88.3405,anonymous,EN,1,,,,,,,,,,,,,,,,,,,,,,,,,,,,3,4,1,1,3,1,6,9,9,5,7,1,4,7,7,8,3,3,6,5,3,6,4,4,5,1,23|4|20|13|11|3|10|19|25|17|15|8|21|14|1|22|6|7|12|16|18|5|2|24|9|26,,,,,,,,,,,,,,,,,,,,,,,,,,,,,,,,,,,,,,,,,,,,,,,,,,,,,,By my gut feeling and some facts i already know about people and things.,46,2,,6,,,social_bullshitter
12/8/22 11:56,12/8/22 12:00,0,75.183.55.106,100,234,1,12/8/22 12:00,R_ZJGQCkavURAq4cV,,,,,36.143,-80.3073,anonymous,EN,1,,,,,,,,,,,,,,,,,,,,,,,,,,,,,,,,,,,,,,,,,,,,,,,,,,,,,,,,,,,,,,,,,,,,,,,,,,,,,,,,,5,1,7,7,4,5,7,3,3,8,9,4,10,4,4,8,6,4,6,4,8,8,8,6,5,3,23|13|9|2|14|8|5|7|17|4|6|25|26|12|20|22|1|18|16|21|11|3|24|19|15|10,I think those with that kind of character would try to convince others in their best way by trying to be convincing and persuasive. They would make things to appear  more than they truly are,43,2,,2,,,social_bullshittee
12/8/22 11:55,12/8/22 12:00,0,71.91.144.186,100,270,1,12/8/22 12:00,R_8Jj8eC5xKTCML3b,,,,,30.4978,-92.3906,anonymous,EN,1,1,1,11,11,11,11,11,1,1,1,1,1,6,1,1,1,1,1,1,1,1,1,1,1,6,1,12|4|3|7|5|14|2|13|22|19|11|15|26|23|25|18|10|9|20|24|21|8|16|6|1|17,,,,,,,,,,,,,,,,,,,,,,,,,,,,,,,,,,,,,,,,,,,,,,,,,,,,,,,,,,,,,,,,,,,,,,,,,,,,,,,,,Such a person is suspicious and not worthy of being honest.,48,2,,2,,,corporate_bullshitter
12/8/22 11:57,12/8/22 12:00,0,173.13.100.193,100,154,1,12/8/22 12:00,R_2rT9HKDS6jqnxIo,,,,,42.5334,-70.9653,anonymous,EN,1,,,,,,,,,,,,,,,,,,,,,,,,,,,,,,,,,,,,,,,,,,,,,,,,,,,,,,,4,3,6,6,6,7,8,7,7,7,6,3,4,6,6,5,4,6,3,3,2,2,2,2,6,2,,,,,,,,,,,,,,,,,,,,,,,,,,,,I based it on personal experiences.,33,1,,6,,,corporate_bullshittee
12/8/22 11:56,12/8/22 12:00,0,66.61.36.106,100,243,1,12/8/22 12:00,R_3OriG37Ts4bDarh,,,,,41.3617,-82.2538,anonymous,EN,1,,,,,,,,,,,,,,,,,,,,,,,,,,,,,,,,,,,,,,,,,,,,,,,,,,,,,,,,,,,,,,,,,,,,,,,,,,,,,,,,,3,4,8,10,6,8,7,8,9,6,7,5,11,5,3,8,8,6,3,7,3,8,3,5,11,7,15|23|19|14|25|5|24|12|21|11|26|8|22|18|20|6|7|16|3|9|17|4|13|2|10|1,"Well a lot of ambitious, nice and successful people are believe the bullshit they hear but that doesn't mean they aren't warm, friendly, or any of the other traits. It just means they fall for it.",68,2,,6,,,social_bullshittee
12/8/22 11:55,12/8/22 12:01,0,24.193.224.66,100,361,1,12/8/22 12:01,R_2Eae0Ny0V7A4m2h,,,,,40.6117,-74.0851,anonymous,EN,1,2,3,8,11,11,10,7,11,11,11,6,3,4,7,2,8,6,6,7,8,2,9,5,4,2,2,17|14|21|2|13|7|16|19|24|11|10|26|18|25|1|23|9|12|5|3|8|6|20|15|4|22,,,,,,,,,,,,,,,,,,,,,,,,,,,,,,,,,,,,,,,,,,,,,,,,,,,,,,,,,,,,,,,,,,,,,,,,,,,,,,,,,"From doing my own research, lots of it! I'm interested in human nature aspects and the different kinds of humans. These judgments and discernments used are also based on personal experience with such persons.",42,2,,1,,,corporate_bullshitter
12/8/22 11:57,12/8/22 12:01,0,73.94.172.77,100,217,1,12/8/22 12:01,R_31sgOlMIApoOlFF,,,,,44.8101,-93.1519,anonymous,EN,1,4,4,6,7,9,6,7,6,4,8,4,4,4,4,4,6,4,4,6,6,4,6,4,4,5,4,2|5|7|22|11|8|4|26|16|6|15|17|10|20|13|3|23|1|19|21|9|12|25|14|24|18,,,,,,,,,,,,,,,,,,,,,,,,,,,,,,,,,,,,,,,,,,,,,,,,,,,,,,,,,,,,,,,,,,,,,,,,,,,,,,,,,"I though about the bullshit sentences on the whole and bullshitting on the whole and considered how bullshitting matched the the possible phrases. Bullshitting is low on honest and high on dominance, for example.",35,2,,6,,,corporate_bullshitter
12/8/22 11:58,12/8/22 12:01,0,74.140.213.231,100,181,1,12/8/22 12:01,R_2Ckot2CDuRg5QzR,,,,,39.7589,-84.0618,anonymous,EN,1,,,,,,,,,,,,,,,,,,,,,,,,,,,,5,3,3,8,3,1,5,9,9,4,7,4,8,7,5,8,8,5,7,8,5,5,4,7,6,2,11|7|16|4|22|8|24|3|5|26|18|21|1|15|20|9|19|23|2|25|6|10|12|13|17|14,,,,,,,,,,,,,,,,,,,,,,,,,,,,,,,,,,,,,,,,,,,,,,,,,,,,,,"I thought about what the sentences meant and how a person would come across saying them, and how likely they were to come true or for the person to believe in them, and then rated accordingly.",38,2,,6,,,social_bullshitter
12/8/22 11:58,12/8/22 12:01,0,216.160.129.235,100,169,1,12/8/22 12:01,R_3KowZxBCMvbfADj,,,,,39.9834,-105.143,anonymous,EN,1,4,2,8,10,11,7,10,11,11,11,10,4,1,11,8,8,3,6,6,2,2,9,10,3,2,6,17|4|22|3|21|25|1|16|20|8|5|13|11|9|7|12|2|18|14|23|15|6|26|19|24|10,,,,,,,,,,,,,,,,,,,,,,,,,,,,,,,,,,,,,,,,,,,,,,,,,,,,,,,,,,,,,,,,,,,,,,,,,,,,,,,,,These people are most likely not the most moral or kind people. They are driven by greed.,45,2,,6,,,corporate_bullshitter
12/8/22 11:59,12/8/22 12:01,0,12.233.2.1,100,132,1,12/8/22 12:01,R_2P7rKSmZjZ0VgZr,,,,,41.3164,-88.5994,anonymous,EN,1,,,,,,,,,,,,,,,,,,,,,,,,,,,,,,,,,,,,,,,,,,,,,,,,,,,,,,,6,6,3,2,2,2,4,6,3,4,2,7,10,4,3,7,8,5,4,3,4,3,3,5,10,4,,,,,,,,,,,,,,,,,,,,,,,,,,,,If someone believes BS they're not rating high.,50,2,,6,,,corporate_bullshittee
12/8/22 12:00,12/8/22 12:01,0,174.131.21.34,100,118,1,12/8/22 12:01,R_3fvOBhyFXZX0hT3,,,,,45.3511,-93.7398,anonymous,EN,1,,,,,,,,,,,,,,,,,,,,,,,,,,,,3,2,8,11,10,6,10,5,5,9,3,3,8,4,2,7,3,1,9,4,2,10,10,8,9,2,14|3|8|5|12|15|9|19|23|24|2|22|25|13|18|17|21|26|6|4|10|11|16|7|20|1,,,,,,,,,,,,,,,,,,,,,,,,,,,,,,,,,,,,,,,,,,,,,,,,,,,,,,"i think someone who acts like this has a lot of negative attributes. they are probably a strong personality who thinks they are always right. in turn, they likely are a person who does not live by a true set of morals.",25,1,,6,,,social_bullshitter
12/8/22 11:56,12/8/22 12:02,0,192.206.56.1,100,309,1,12/8/22 12:02,R_10NpKa9v6p0PHcS,,,,,37.7007,-97.4383,anonymous,EN,1,,,,,,,,,,,,,,,,,,,,,,,,,,,,,,,,,,,,,,,,,,,,,,,,,,,,,,,1,1,3,5,4,4,6,10,9,9,6,4,10,6,3,9,6,5,3,3,2,5,4,3,7,3,,,,,,,,,,,,,,,,,,,,,,,,,,,,People who buy into the corporate culture and speak are just trying to boost their image in hopes of fitting in and getting a larger role in the company.  They will do whatever they need to in order to be accepted.  They are just gullible people looking for a place.,39,2,,6,,,corporate_bullshittee
12/8/22 11:55,12/8/22 12:02,0,70.119.119.98,100,417,1,12/8/22 12:02,R_3RqnqPMgmezDntp,,,,,33.0928,-96.6454,anonymous,EN,1,,,,,,,,,,,,,,,,,,,,,,,,,,,,,,,,,,,,,,,,,,,,,,,,,,,,,,,5,5,4,6,4,1,2,3,3,2,3,2,4,4,2,4,5,1,5,5,2,6,5,3,6,1,,,,,,,,,,,,,,,,,,,,,,,,,,,,I think that someone who would say the kinds of example sentences on the previous page fully believes that they are making very persuasive and influential statements and I think that they think they are intelligent in their career. I don't think it is always being done maliciously because they probably have heard these kinds of phrases since they entered their chosen field. They probably think highly of themselves because they can put big words together and sound convincing but I don't think their main goal is always to deceive the listener.,37,2,,6,,,corporate_bullshittee
12/8/22 11:59,12/8/22 12:02,0,63.230.236.49,100,212,1,12/8/22 12:02,R_30vi6mkcLdKHPww,,,,,33.2516,-111.7006,anonymous,EN,1,,,,,,,,,,,,,,,,,,,,,,,,,,,,,,,,,,,,,,,,,,,,,,,,,,,,,,,,,,,,,,,,,,,,,,,,,,,,,,,,,2,5,4,3,2,3,4,7,6,4,3,8,11,4,3,9,8,5,3,3,3,2,3,5,11,7,12|5|19|22|16|4|23|15|1|3|2|21|26|8|17|24|9|25|14|20|13|7|11|18|6|10,They believe in people too much. They are like children.,39,1,,6,,,social_bullshittee
12/8/22 11:56,12/8/22 12:03,0,73.157.0.120,100,416,1,12/8/22 12:03,R_xyzsmZEknH1vW4F,,,,,47.2476,-122.4643,anonymous,EN,1,,,,,,,,,,,,,,,,,,,,,,,,,,,,3,2,4,7,6,6,6,4,3,6,3,3,6,2,3,4,4,3,1,3,2,1,2,4,1,1,8|3|18|5|22|16|7|15|4|24|26|1|23|11|20|10|25|14|13|6|17|2|12|21|19|9,,,,,,,,,,,,,,,,,,,,,,,,,,,,,,,,,,,,,,,,,,,,,,,,,,,,,,"the person seem pessimistic, not optimistic about the future.  ",43,1,,2,,,social_bullshitter
12/8/22 11:58,12/8/22 12:03,0,209.105.128.90,100,267,1,12/8/22 12:03,R_SJGkOWdicYVPKKJ,,,,,44.6048,-72.9561,anonymous,EN,1,,,,,,,,,,,,,,,,,,,,,,,,,,,,,,,,,,,,,,,,,,,,,,,,,,,,,,,,,,,,,,,,,,,,,,,,,,,,,,,,,6,6,2,2,2,6,6,6,6,6,6,6,11,5,3,6,6,2,6,1,1,2,6,3,10,6,15|11|24|22|5|3|4|18|17|26|21|16|25|1|20|13|23|10|12|2|19|8|7|9|6|14,"For many of the personality aspects, it was impossible to draw a conclusion based solely on the likelihood of them believing that kind of bullshit, so I rated those in the middle.  But I rated them higher on factors like gullibility and lower on things like intelligence based on their willing to swallow the BS. ",64,1,,3,,,social_bullshittee
12/8/22 11:48,12/8/22 12:03,0,67.44.160.53,100,877,1,12/8/22 12:03,R_Ya8D2XFjAe1nbGh,,,,,35.2296,-80.843,anonymous,EN,1,1,1,9,11,2,11,11,10,4,1,1,1,8,1,1,3,1,1,1,1,1,1,1,1,8,1,23|9|16|3|25|22|17|13|20|26|11|8|12|5|21|7|6|4|2|19|10|24|18|15|1|14,,,,,,,,,,,,,,,,,,,,,,,,,,,,,,,,,,,,,,,,,,,,,,,,,,,,,,,,,,,,,,,,,,,,,,,,,,,,,,,,,"Someone who uses stupid phrases, lies, and tries to make themselves look better than what they are aren't worth a penny in the business world. Unless, of course, they are in politics.",53,2,,6,,,corporate_bullshitter
12/8/22 12:00,12/8/22 12:03,0,73.206.34.173,100,200,1,12/8/22 12:03,R_1IyH3AFneaMmww4,,,,,29.7388,-95.8309,anonymous,EN,1,6,6,9,9,9,9,9,9,7,9,6,6,9,6,6,8,6,6,8,8,8,8,7,8,6,6,9|7|8|26|14|17|10|25|2|23|12|3|11|18|24|21|16|15|6|4|5|13|20|19|1|22,,,,,,,,,,,,,,,,,,,,,,,,,,,,,,,,,,,,,,,,,,,,,,,,,,,,,,,,,,,,,,,,,,,,,,,,,,,,,,,,,-,34,2,,1,,,corporate_bullshitter
12/8/22 12:00,12/8/22 12:03,0,172.113.41.11,100,185,1,12/8/22 12:03,R_2dnG5x03qrw07Vc,,,,,34.0767,-118.1802,anonymous,EN,1,,,,,,,,,,,,,,,,,,,,,,,,,,,,,,,,,,,,,,,,,,,,,,,,,,,,,,,6,6,6,4,6,4,4,7,6,5,7,6,5,6,6,7,7,6,6,6,6,7,7,6,5,3,,,,,,,,,,,,,,,,,,,,,,,,,,,,For the most part I was neutral. But i leaned more to the right or left depending on where I felt the person would stand. ,30,1,,1,,,corporate_bullshittee
12/8/22 12:01,12/8/22 12:03,0,99.101.177.40,100,165,1,12/8/22 12:03,R_2txUvFqPNNlUuxy,,,,,42.3667,-88.0925,anonymous,EN,1,,,,,,,,,,,,,,,,,,,,,,,,,,,,,,,,,,,,,,,,,,,,,,,,,,,,,,,,,,,,,,,,,,,,,,,,,,,,,,,,,6,5,7,11,9,9,11,7,6,8,6,8,7,7,4,7,9,7,8,7,5,5,6,7,5,5,17|9|15|22|12|19|2|16|23|11|8|20|4|5|10|13|21|24|3|7|1|6|18|25|26|14,I have met quite a few people like the one previously described. I based my answer off of my own personal interactions with such people.,40,1,,6,,,social_bullshittee
12/8/22 11:46,12/8/22 12:03,0,162.210.194.10,100,1043,1,12/8/22 12:04,R_8tRq2lpLPYE6ssV,,,,,39.7356,-75.5516,anonymous,EN,1,,,,,,,,,,,,,,,,,,,,,,,,,,,,,,,,,,,,,,,,,,,,,,,,,,,,,,,8,7,8,7,7,8,8,7,8,8,7,8,8,7,7,7,8,8,7,8,7,8,7,7,8,7,,,,,,,,,,,,,,,,,,,,,,,,,,,,"Despite the fact that bullshit is encountered almost on a daily basis, i personally fee like it helps in a way to understand what is not.",32,1,,2,,,corporate_bullshittee
12/8/22 12:01,12/8/22 12:04,0,147.97.34.212,100,176,1,12/8/22 12:04,R_3dFgNKVPnPbw90J,,,,,35.8308,-90.7023,anonymous,EN,1,2,2,11,10,7,9,10,4,5,10,2,2,5,4,5,6,3,5,7,4,7,8,8,4,4,4,13|10|12|3|26|16|20|8|17|14|2|6|24|15|1|11|4|18|9|22|23|21|19|7|25|5,,,,,,,,,,,,,,,,,,,,,,,,,,,,,,,,,,,,,,,,,,,,,,,,,,,,,,,,,,,,,,,,,,,,,,,,,,,,,,,,,"I typically don't trust bullshitters, as they are typically out for their own benefit (in my opinion).",37,1,,6,,,corporate_bullshitter
12/8/22 12:02,12/8/22 12:04,0,174.55.253.213,100,126,1,12/8/22 12:04,R_231UsbpNaKj4faq,,,,,41.1408,-77.444,anonymous,EN,1,,,,,,,,,,,,,,,,,,,,,,,,,,,,1,3,8,11,11,10,11,10,8,8,2,2,4,2,3,4,3,6,2,2,2,4,4,2,4,2,13|26|16|14|2|15|21|17|19|3|11|1|10|8|12|4|24|6|7|5|25|23|9|18|20|22,,,,,,,,,,,,,,,,,,,,,,,,,,,,,,,,,,,,,,,,,,,,,,,,,,,,,,The people are BSers.  They are not good people.  They are in it for themselves and don't care about others.,30,1,,6,,,social_bullshitter
12/8/22 12:02,12/8/22 12:04,0,208.95.130.2,100,155,1,12/8/22 12:04,R_XhrCMCn1A2Vn99n,,,,,37.751,-97.822,anonymous,EN,1,,,,,,,,,,,,,,,,,,,,,,,,,,,,,,,,,,,,,,,,,,,,,,,,,,,,,,,4,4,6,5,5,5,4,2,5,4,1,6,11,2,2,6,6,6,5,2,2,3,3,2,11,6,,,,,,,,,,,,,,,,,,,,,,,,,,,,"I pictured the kind of person who would believe such statements.  I then thought about what kind of person that would be and whether a particular trait would likely apply to them, and to what degree.",51,1,,6,,,corporate_bullshittee
12/8/22 12:03,12/8/22 12:05,0,76.121.211.194,100,130,1,12/8/22 12:05,R_AmKBQlRXTLxRqSZ,,,,,47.6144,-122.3447,anonymous,EN,1,,,,,,,,,,,,,,,,,,,,,,,,,,,,2,2,9,8,9,9,9,9,4,6,4,2,3,4,3,2,2,2,5,3,2,6,6,2,2,2,5|14|4|9|11|7|22|20|13|24|23|19|10|21|6|12|17|15|1|8|18|16|26|25|2|3,,,,,,,,,,,,,,,,,,,,,,,,,,,,,,,,,,,,,,,,,,,,,,,,,,,,,,I think of them as people who don't actually care but want to sound impressive. They are willing to be deceitful to appear smarter or look better.,30,1,,7,White and Asian,,social_bullshitter
12/8/22 11:58,12/8/22 12:05,0,99.63.16.63,100,398,1,12/8/22 12:05,R_30w487GolGwEpan,,,,,39.1995,-94.5265,anonymous,EN,1,,,,,,,,,,,,,,,,,,,,,,,,,,,,,,,,,,,,,,,,,,,,,,,,,,,,,,,3,2,4,9,6,7,8,7,7,8,5,4,2,7,4,5,6,6,5,2,1,7,8,5,4,1,,,,,,,,,,,,,,,,,,,,,,,,,,,,"A bullshitter is typically looking out for themselves first.  They are also trying to look good and impress others with their alleged knowledge. Besides corporate executives, politicians are routinely bullshitting us. ",64,1,,6,,,corporate_bullshittee
12/8/22 12:02,12/8/22 12:06,0,74.126.45.111,100,217,1,12/8/22 12:06,R_yl8uvUC3E6Ruz3r,,,,,40.3626,-83.7565,anonymous,EN,1,,,,,,,,,,,,,,,,,,,,,,,,,,,,,,,,,,,,,,,,,,,,,,,,,,,,,,,3,6,7,10,7,7,8,7,7,5,3,5,7,4,2,8,6,5,3,3,2,5,4,4,8,4,,,,,,,,,,,,,,,,,,,,,,,,,,,,"I generally don't look highly on people who follow corporate speak.  In my experience, they're either gullible or duplicitous depending on the circumstances.",40,1,,6,,,corporate_bullshittee
12/8/22 12:04,12/8/22 12:06,0,64.92.86.2,100,136,1,12/8/22 12:06,R_2VdKtM9HJidFVpw,,,,,40.598,-111.9619,anonymous,EN,1,2,1,9,9,11,9,10,10,10,10,5,10,8,4,5,9,9,6,9,9,2,8,8,6,2,8,14|26|6|19|3|11|9|15|23|10|21|7|16|17|18|24|2|5|25|8|1|12|4|20|22|13,,,,,,,,,,,,,,,,,,,,,,,,,,,,,,,,,,,,,,,,,,,,,,,,,,,,,,,,,,,,,,,,,,,,,,,,,,,,,,,,,"Just that people who use these terms tend to want to appear smart, charismatic, and personable, but tend to not actually know what they are talking about. ",38,1,,6,,,corporate_bullshitter
